{"$schema":"https://json-schema.org/draft/2020-12/schema","$id":"urn:aicontrolcenter:governance:v1:authorization-state-record","title":"GovernanceAuthorizationStateRecord","type":"object","additionalProperties":false,"required":["schema_version","authorization_id","previous_state","current_state","transition_reason","transitioned_at","precondition_comparison_digest","audit_event_id"],"properties":{"schema_version":{"const":"governance/v1"},"authorization_id":{"$ref":"#/$defs/text"},"previous_state":{"$ref":"#/$defs/state"},"current_state":{"$ref":"#/$defs/state"},"transition_reason":{"$ref":"#/$defs/text"},"transitioned_at":{"type":"string","format":"date-time"},"precondition_comparison_digest":{"$ref":"#/$defs/nullableText"},"audit_event_id":{"$ref":"#/$defs/nullableText"}},"allOf":[{"if":{"properties":{"previous_state":{"const":"REQUESTED"}}},"then":{"properties":{"current_state":{"enum":["AUTHORIZED","REJECTED"]}}}},{"if":{"properties":{"previous_state":{"const":"AUTHORIZED"}}},"then":{"properties":{"current_state":{"enum":["STALE","CONSUMED"]}}}}],"$defs":{"text":{"type":"string","minLength":1},"nullableText":{"oneOf":[{"$ref":"#/$defs/text"},{"type":"null"}]},"state":{"enum":["REQUESTED","AUTHORIZED","STALE","CONSUMED","REJECTED"]}}}
